{
  "journeyId": "deposit-account-digital",
  "product": "deposit-account",
  "channel": "digital",
  "steps": [
    { "order": 1, "module": "overview", "required": true },
    { "order": 2, "module": "phone-otp", "required": true },
    { "order": 3, "module": "profile-setup", "required": true },
    { "order": 4, "module": "identity-verification", "required": true },
    { "order": 5, "module": "address-info", "required": true },
    { "order": 6, "module": "employment-info", "required": true },
    { "order": 7, "module": "credit-cross-sell", "required": false, "conditional": true, "notes": "Only shown if server/rules/creditOffer.js eligibility check passes." },
    { "order": 8, "module": "tax-questions", "required": true },
    { "order": 9, "module": "terms-and-conditions", "required": true },
    { "order": 10, "module": "fund-account", "required": true },
    { "order": 11, "module": "confirmation", "required": true }
  ],
  "metadata": {
    "lastUpdated": "2026-07-18",
    "owner": "Digital Onboarding Product Team (SYNTHETIC)"
  }
}
